{"dmca":{"id":28570,"type":"Dmca","title":"[ThePlanetAbuse-C4391645U] Demand for Immediate Take Down - Notice of Infringing Acti","body":"\r\n\r\n\r\n-----Original Message-----\r\nFrom: abuse@theplanet.com [mailto:abuse@theplanet.com] \r\nSent: Monday, June 04, 2007 12:10 AM\r\nTo: DMCA\r\nCc: White, Garrett\r\nSubject: [ThePlanetAbuse-C4391645U] Demand for Immediate Take Down -\r\nNotice of Infringing Activity - MS Ref. 93350\r\n\r\n==== Forwarded Ticket ====\r\n1. Demand for Immediate Take Down - Notice of Infringing Activity - MS\r\nRef. 93350\r\nAdded by system at Monday, Jun 4 2007 05:03 am \r\nX-MailFrom: Internet3@Microsoft-Antipiracy.com \r\nX-RcptTo: abacus@abacus.ev1servers.net \r\nReceived: from [216.12.192.67] by [216.12.192.78] (abacus) for\r\n<abacus@abacus.ev1servers.net>; Mon Jun 4 05:03:19 2007 \r\nReceived: (qmail 26187 invoked by alias); 4 Jun 2007 10:03:18 -0000 \r\nDelivered-To: abuse@inbound.abacus.ev1servers.net \r\nReceived: (qmail 26184 invoked from network); 4 Jun 2007 10:03:18 -0000 \r\nReceived: from spooling.theplanet.com (69.56.141.4) \r\n  by inbound.abacus.ev1servers.net with SMTP; 4 Jun 2007 10:03:18 -0000 \r\nReturn-path: <Internet3@Microsoft-Antipiracy.com> \r\nDelivery-date: Mon, 04 Jun 2007 05:03:19 -0500 \r\nReceived: from [172.16.220.10] (helo=DALD2EXCH01.PLANET.LOCAL) \r\n by spooling.theplanet.com (envelope-from\r\nInternet3@Microsoft-Antipiracy.com) \r\n with esmtp (Exim) \r\n id 1Hv9PC-00013G-Pi \r\n for abuse@inbound.abacus.ev1servers.net; Mon, 04 Jun 2007 05:03:18\r\n-0500 \r\nReceived: from Exchanger.ev1servers.net ([207.218.222.102]) by\r\nDALD2EXCH01.PLANET.LOCAL with Microsoft SMTPSVC(6.0.3790.1830); \r\n         Mon, 4 Jun 2007 05:02:27 -0500 \r\nReceived: from mailin.ev1servers.net ([207.218.222.124]) by\r\nExchanger.ev1servers.net with Microsoft SMTPSVC(6.0.3790.1830); \r\n         Mon, 4 Jun 2007 05:02:27 -0500 \r\nX-ASG-Debug-ID: 1180951341-25817-51-0 \r\nX-Barracuda-URL: http://207.218.222.124:8000/cgi-bin/mark.cgi \r\nX-ASG-Recipient-Whitelist:  dmca@EV1Servers.net \r\nX-ASG-Recipient-Whitelist:  abuse@ev1servers.net \r\nReceived: from adsrv01.CIUEXM.NET (mail.ciuexm.net [213.208.96.3]) \r\n        by mailin.ev1servers.net (Spam Firewall) with ESMTP \r\n        id D276C78956; Mon,  4 Jun 2007 05:02:26 -0500 (CDT) \r\nx-pgp-universal-saved-content-codepage: iso-8859-1 \r\nMIME-Version: 1.0 \r\nContent-Type: multipart/mixed; \r\n        boundary=\"----_=_NextPart_001_01C7A68E.7A3C4CCC\" \r\nContent-class: urn:content-classes:message \r\nx-pgp-mapi-encoding-version: 2.5.0 \r\nX-MimeOLE: Produced By Microsoft Exchange V6.5 \r\nX-ASG-Orig-Subj: Demand for Immediate Take Down - Notice of Infringing\r\nActivity - MS Ref. 93350 \r\nSubject: Demand for Immediate Take Down - Notice of Infringing Activity\r\n- MS Ref. 93350 \r\nDate: Mon, 4 Jun 2007 10:55:26 +0100 \r\nMessage-ID: <5EB28A2AFFC89F4686C426F38B9F7D7C467A61@adsrv01.CIUEXM.NET> \r\nX-MS-Has-Attach: yes \r\nX-MS-TNEF-Correlator:  \r\nThread-Topic: Demand for Immediate Take Down - Notice of Infringing\r\nActivity - MS Ref. 93350 \r\nThread-Index: Acemjnn2t5/34KigTxioiIaN2n6pUw== \r\nFrom: \"MSAntipiracy03\" <Internet3@Microsoft-Antipiracy.com> \r\nTo: <abuse@ev1servers.net>, \r\n        <dmca@ev1servers.net> \r\nX-Virus-Scanned: by Barracuda Spam Firewall at ev1servers.net \r\nX-Barracuda-Spam-Score: 0.00 \r\nX-Barracuda-Spam-Status: No, SCORE=0.00 using global scores of\r\nTAG_LEVEL=4.0 QUARANTINE_LEVEL=1000.0 KILL_LEVEL=8.0 WHITELISTED  \r\nX-OriginalArrivalTime: 04 Jun 2007 10:02:27.0343 (UTC)\r\nFILETIME=[74CC51F0:01C7A68F] \r\n\r\n (multipart/mixed) \r\nMultipart prefix (text/plain) \r\nThis is a multi-part message in MIME format. \r\n \r\nMIME element (text/plain) \r\n\r\n* PGP Signed by an unmatched address: 06/04/07 at 04:55:26\r\n\r\nVIA EMAIL:  \r\n \r\nDemand for Immediate Take-Down: Notice of Infringing Activity  \r\n \r\nURL: http://www.stormcert.com/  \r\nhttp://www.stormcert.com/pricing.htm  \r\nhttp://www.stormcert.com/service.htm  \r\nhttp://www.stormcert.com/contact.htm  \r\nCASE #: 93350  \r\n \r\n04 June 2007  \r\n \r\nDear Sir or Madam,  \r\n \r\nMicrosoft has received information that the domain listed above, which\r\nappears to be on servers under your control, is offering unlicensed\r\ncopies of, or is engaged in other unauthorized activities relating to\r\ncopyrighted works published by Microsoft. \r\n \r\n1. Identification of copyrighted works:  \r\n \r\nCopyrighted work(s):  \r\nCertificate: Microsoft Certified Systems Administrator on Microsoft\r\nWindows Server 2003  \r\nCertificate: Microsoft Certified Database Administrator  \r\nCertificate: Microsoft Certified Database Administrator 2000  \r\nCertificate: Microsoft Certified Systems Engineer on Microsoft Windows\r\n2000  \r\nCertificate: Microsoft Certified Systems Administrator on Microsoft\r\nWindows 2000  \r\nCertificate: Microsoft Certified Systems Engineer on Microsoft Windows\r\n2003  \r\nCertificate: Microsoft Certified Database Administrator 2003  \r\nCertificate: Microsoft Certified Solution Developer for Microsoft .NET  \r\nCertificate: Microsoft Certified Application Developer for Microsoft\r\n.NET  \r\nCertificate: Microsoft Certified Desktop Support Technician  \r\n \r\nCopyright owner:  \r\nMicrosoft Corporation  \r\n \r\n2. Copyright infringing material or activity found at the following\r\nlocation(s):  \r\n \r\nhttp://www.stormcert.com/  \r\nhttp://www.stormcert.com/pricing.htm  \r\nhttp://www.stormcert.com/service.htm  \r\nhttp://www.stormcert.com/contact.htm  \r\n \r\nThe above location is offering to distribute unauthorized copies of\r\ncopyrighted works.  \r\n \r\n3. Statement of authority:  \r\n \r\nThe information in this notice is accurate, and I hereby certify under\r\npenalty of perjury that I am authorized to act on behalf of Microsoft,\r\nthe owner of the copyright(s) in the work(s) identified above.  I have a\r\ngood faith belief that none of the materials or activities listed above\r\nhave been authorized by Microsoft, its agents, or the law. \r\n \r\nWe hereby give notice of these activities to you and request that you\r\ntake expeditious action to remove or disable access to the material\r\ndescribed above, and thereby prevent the illegal reproduction and\r\ndistribution of this copyrighted work via your company's network. \r\n \r\nWe appreciate your cooperation in this matter. Please advise us\r\nregarding what actions you take.  \r\n \r\nYours sincerely,  \r\n \r\nEmma Rutherford  \r\nInternet Investigator  \r\n \r\non behalf of Microsoft Corporation  \r\nOne Microsoft Way  \r\nRedmond, WA 98052  \r\nUnited States of America  \r\n \r\nE-mail: Internet1@microsoft-antipiracy.com  \r\n \r\n \r\n\r\n* MSAntiPiracy03 <internet3@microsoft-antipiracy.com>\r\n* 0x25BF18FF(L)\r\n\r\n \r\n \r\nMIME element (application/octet-stream) \r\nMIME element (text/plain)\r\n\r\n","date_sent":"2005-06-04T04:00:00Z","date_received":"2005-06-04T04:00:00Z","topics":["Copyright","DMCA Safe Harbor"],"sender_name":null,"principal_name":"Microsoft Corporation","recipient_name":"ThePlanet.com","works":[{"description":"Unknown work","infringing_urls":[],"copyrighted_urls":[]}],"tags":[],"jurisdictions":[],"action_taken":"Yes","language":null}}