{"dmca":{"id":29503,"type":"Dmca","title":"[ABUSE] Notice of Copyright Infringement/DMCA Take Down Demand per 17 USC 512 (c)","body":"\r\n\r\n \r\n\r\n-----Original Message-----\r\nFrom: abuseadm@theplanet.com [mailto:abuseadm@theplanet.com] On Behalf\r\nOf Policy Enforcement\r\nPosted At: Tuesday, May 23, 2006 6:47 AM\r\nPosted To: Copyright\r\nConversation: [Fwd: [ABUSE] Notice of Copyright Infringement/DMCA Take\r\nDown Demand per 17 USC 512 (c)]\r\nSubject: [Fwd: [ABUSE] Notice of Copyright Infringement/DMCA Take Down\r\nDemand per 17 USC 512 (c)]\r\n\r\n\r\n-----BEGIN PGP SIGNED MESSAGE-----\r\nHash: SHA1\r\n\r\nFor your review.\r\n\r\nThank you,\r\n\r\nPolicy Enforcement\r\nThe Planet Internet Services, Inc.\r\nhttp://www.theplanet.com/legal/\r\n\r\n- -------- Original Message --------\r\nFrom: - Mon May 22 23:34:55 2006\r\nX-Mozilla-Status: 0001\r\nX-Mozilla-Status2: 00000000\r\nReceived: from localhost ([127.0.0.1] helo=[216.185.111.52])        by\r\nmail.theplanet.com (envelope-from abuse-bounces@lists.theplanet.com)\r\nwith esmtp (Exim)        id 1FiObc-0002Qp-8N; Mon, 22 May 2006 23:34:52\r\n-0500\r\nReceived: from mx02.inside.filter.theplanet.com ([172.16.214.181]\r\nhelo=mx02.filter.theplanet.com)        by mail.theplanet.com (envelope-from\r\nwebmaster@proxify.com)        with esmtps (TLSv1:DHE-RSA-AES256-SHA:256)\r\n(Exim) id 1FiOba-0002Qi-BV        for abuse@theplanet.com; Mon, 22 May\r\n2006\r\n23:34:50 -0500\r\nReceived: from frak.upsideout.com ([66.98.178.22])        by\r\nmx02.filter.theplanet.com (envelope-from webmaster@proxify.com)        with\r\nesmtps (TLSv1:DHE-RSA-AES256-SHA:256) (Exim) id 1FiObY-000OWf-0j\r\nfor\r\nabuse@theplanet.com; Mon, 22 May 2006 23:34:50 -0500\r\nReceived: from ool-44c15810.dyn.optonline.net ([68.193.88.16]\r\nhelo=[192.168.0.100])        by frak.upsideout.com with esmtpsa\r\n(TLSv1:RC4-SHA:128) (Exim 4.52)        id 1FiObV-0001Wn-HA        for\r\nabuse@theplanet.com; Tue, 23 May 2006 00:34:45 -0400\r\nMime-Version: 1.0 (Apple Message framework v750)\r\nContent-Transfer-Encoding: 7bit\r\nMessage-Id: <5FFA42A2-A45E-4536-8BEB-FF1DF8802451@proxify.com>\r\nContent-Type: text/plain; charset=US-ASCII; delsp=yes; format=flowed\r\nTo: abuse@theplanet.com\r\nFrom: Justin S. <webmaster@proxify.com>\r\nDate: Tue, 23 May 2006 00:34:48 -0400\r\nX-Mailer: Apple Mail (2.750)\r\nX-AntiAbuse: This header was added to track abuse,        please include\r\nit\r\nwith any abuse report\r\nX-AntiAbuse: Primary Hostname - frak.upsideout.com\r\nX-AntiAbuse: Original Domain - theplanet.com\r\nX-AntiAbuse: Originator/Caller UID/GID - [47 12] / [47 12]\r\nX-AntiAbuse: Sender Address Domain - proxify.com\r\nX-Source:\r\nX-Source-Args:\r\nX-Source-Dir:\r\nReceived-SPF: pass (mx02.filter.theplanet.com: domain of proxify.com\r\ndesignates 66.98.178.22 as permitted sender)        client-ip=66.98.178.22;\r\nenvelope-from=webmaster@proxify.com;        helo=frak.upsideout.com;\r\nX-Spam-Level: ---------------------------------------------------\r\nX-Spam-Score: -101.2\r\nSubject: [ABUSE] Notice of Copyright Infringement/DMCA Take Down\r\nDemand per        17 USC 512 (c)\r\nX-BeenThere: abuse@lists.theplanet.com\r\nX-Mailman-Version: 2.1.7\r\nPrecedence: list\r\nList-Id: <abuse.lists.theplanet.com>\r\nList-Unsubscribe: <http://lists.theplanet.com/mailman/listinfo/abuse>,\r\n<mailto:abuse-request@lists.theplanet.com?subject=unsubscribe>\r\nList-Post: <mailto:abuse@lists.theplanet.com>\r\nList-Help: <mailto:abuse-request@lists.theplanet.com?subject=help>\r\nList-Subscribe: <http://lists.theplanet.com/mailman/listinfo/abuse>,\r\n<mailto:abuse-request@lists.theplanet.com?subject=subscribe>\r\nSender: abuse-bounces@lists.theplanet.com\r\nErrors-To: abuse-bounces@lists.theplanet.com\r\n\r\nTo Whom It May Concern:\r\n\r\nI am writing to file a notice of copyright infringement in accordance\r\nwith the Digital Millennium Copyright Act.\r\n\r\n1. The copyrighted work at issue is the text that appears on \"http://\r\nproxify.com/\". Proxify.com is a wholly owned subsidiary of UpsideOut,\r\nInc. and has been in operation since 2003-04-14.\r\n\r\n2. The material that we believe is infringing the copyrighted work\r\nlisted in item #1 appears on \"http://www.sleekproxy.com/\" which is\r\nlocated at IP address \"67.18.208.118\". Specifically, the material is,\r\n\"SleekProxy.com is a free web-based anonymous proxy service which allows\r\nanyone to surf the Web privately and securely. Just enter a URL (website\r\naddress) in the form above, you can use websites but they cannot\r\nuniquely identify or track you. SleekProxy hides your IP address and our\r\nencrypted connection prevents monitoring of your network traffic.\". This\r\nmaterial is copied entirely except that all the appearances of our\r\ntrademark and tradename \"Proxify\" have been changed to their name.\r\n\r\n\r\n3. My contact information:\r\nName: Justin Schlecter\r\nCompany: UpsideOut, Inc. D.B.A Proxify\r\nAddress: 1333A N. Ave., STE 315, New Rochelle, NY 10804\r\nPhone: 1-877-PROXIFY\r\nEmail: webmaster@proxify.com\r\n\r\n\r\n4. Contact information for the owner of the allegedly infringing\r\nmaterial:\r\n   ServerCube.com\r\n   Server Cube (tokyofriends@gmail.com)\r\n   +1.3475636346\r\n   Fax: +1.2123345169\r\n   Prince Street Station\r\n   P.O. Box 55\r\n   New York, NY 10012\r\n   US\r\n\r\n\r\n5. I have a good faith belief that use of the copyrighted materials\r\ndescribed above as allegedly infringing is not authorized by the\r\ncopyright owner, its agent, or the law.\r\n\r\n6. I swear, under penalty of perjury, that the information in the\r\nnotification is accurate and that I am the copyright owner or am\r\nauthorized to act on behalf of the owner of an exclusive right that is\r\nallegedly infringed.\r\n\r\nSigned,\r\nJustin Schlecter, 2006-05-23\r\nProxify.com Administrator\r\n1-877-PROXIFY\r\n\r\n\r\n\r\n\r\n\r\n\r\n\r\n-----BEGIN PGP SIGNATURE-----\r\nVersion: GnuPG v1.2.5 (MingW32)\r\n\r\niD8DBQFEcvYjvK/XpJs6oyURAiSVAKCqwBvPDZFWZiu8u2cTMwGxEO+tpACgjbbg\r\nxW3vwmjJh+RIcVAp90dCoAE=\r\n=S1Lx\r\n-----END PGP SIGNATURE-----\r\n\r\n","date_sent":"2007-05-22T04:00:00Z","date_received":"2007-05-22T04:00:00Z","topics":["Copyright","DMCA Safe Harbor"],"sender_name":null,"principal_name":"Proxify.com","recipient_name":"ThePlanet.com","works":[{"description":"Unknown work","infringing_urls":[],"copyrighted_urls":[]}],"tags":[],"jurisdictions":[],"action_taken":"Yes","language":null}}