{"dmca":{"id":25856,"type":"Dmca","title":"[ThePlanetAbuse-C3895844O] Republishing Engadget content","body":"To Whom It May Concern:\r\n\r\nPlease note that below-referenced copyright infringement notice does not\r\nsubstantially comply with the required notification elements of the\r\nDigital Millennium Copyright Act of 1998 (\"DMCA\").\r\n\r\nPlease note that we have not passed on the substantive merits of your\r\nclaim.\r\n\r\nPlease visit our web site at\r\nwww.theplanet.com/about_us/legal_docs/ThePlanet%20Copyright%20Infringeme\r\nnt%2001%2015%2007%20FINAL.pdf\r\n \r\nLegal Response Team\r\nTHEPLANET.COM INTERNET SERVICES, INC.\r\n-----Original Message-----\r\nFrom: abuse@theplanet.com [mailto:abuse@theplanet.com] \r\nSent: Saturday, April 28, 2007 9:37 AM\r\nTo: Copyright\r\nSubject: [ThePlanetAbuse-C3895844O] Republishing Engadget content\r\n\r\n==== Forwarded Ticket ====\r\n1. Republishing Engadget content\r\nAdded by system at Saturday, Apr 28 2007 01:14 pm \r\nX-MailFrom: ryan@engadget.com \r\nX-RcptTo: abacus@abacus.ev1servers.net \r\nReceived: from [216.12.192.67] by [216.12.192.78] (abacus) for\r\n<abacus@abacus.ev1servers.net>; Sat Apr 28 13:14:30 2007 \r\nReceived: (qmail 20393 invoked by alias); 28 Apr 2007 18:14:30 -0000 \r\nDelivered-To: abuse@inbound.abacus.ev1servers.net \r\nReceived: (qmail 20390 invoked from network); 28 Apr 2007 18:14:30 -0000\r\n\r\nReceived: from smtp01.theplanet.com (70.87.6.110) \r\n  by inbound.abacus.ev1servers.net with SMTP; 28 Apr 2007 18:14:30 -0000\r\n\r\nReceived: from mail.theplanet.com ([216.185.111.52]) by\r\nsmtp01.theplanet.com with Microsoft SMTPSVC(6.0.3790.1830); \r\n  Sat, 28 Apr 2007 13:14:30 -0500 \r\nReturn-path: <ryan@engadget.com> \r\nDelivery-date: Sat, 28 Apr 2007 13:14:30 -0500 \r\nReceived: from mx01.inside.filter.theplanet.com ([172.16.214.180]\r\nhelo=mx01.filter.theplanet.com) \r\n by mail.theplanet.com (envelope-from ryan@engadget.com) \r\n with esmtps (TLSv1:DHE-RSA-AES256-SHA:256) \r\n (Exim) \r\n        id 1HhrRF-0001vV-Th; Sat, 28 Apr 2007 13:14:29 -0500 \r\nReceived: from mail.frankensite.com ([206.252.131.157]) \r\n        by mx01.filter.theplanet.com (envelope-from ryan@engadget.com) \r\n        with esmtps (SSLv3:DHE-RSA-AES256-SHA:256) \r\n        (Exim) \r\n        id 1HhrR3-000L90-70; Sat, 28 Apr 2007 13:14:17 -0500 \r\nReceived: from [10.0.0.109] ([67.188.33.207]) \r\n        by mail.frankensite.com (Merak 8.3.1) with ASMTP id HWP15242; \r\n        Sat, 28 Apr 2007 14:13:42 -0400 \r\nMime-Version: 1.0 (Apple Message framework v752.3) \r\nContent-Type: text/plain; charset=US-ASCII; delsp=yes; format=flowed \r\nMessage-Id: <7A9FFC18-E506-491F-8616-F95FF3A3FC5D@engadget.com> \r\nCc: abuse@theplanet.com, \r\n admins@theplanet.com \r\nContent-Transfer-Encoding: 7bit \r\nFrom: Ryan Block <ryan@engadget.com> \r\nSubject: Republishing Engadget content \r\nDate: Sat, 28 Apr 2007 11:13:38 -0700 \r\nTo: rich@mcmanners.co.uk \r\nX-Mailer: Apple Mail (2.752.3) \r\nX-OriginalArrivalTime: 28 Apr 2007 18:14:30.0513 (UTC)\r\nFILETIME=[10B1CE10:01C789C1] \r\n\r\nMIME element (text/plain) \r\nHi there, \r\n \r\nIt appears that you're republishing Engadget content on your site   \r\n(http://www.paniczoom.eu/story-193-xbox-360-elite-vs-classic-the-  \r\ntest.html). Please note that republishing our content in whole is in   \r\nviolation of Weblogs, Inc. and AOL copyright and terms of service.   \r\nFeel free to use 50 word excepts (with proper linkback), but   \r\notherwise we have to ask you take down our content. You may contact   \r\nme with any further questions regarding this matter. Thank you for   \r\nyour understanding and cooperation! \r\n \r\n-- \r\nBest, \r\nRyan Block \r\nManaging Editor, Engadget ","date_sent":"2007-04-28T04:00:00Z","date_received":"2007-04-28T04:00:00Z","topics":["Copyright","DMCA Safe Harbor"],"sender_name":null,"principal_name":"Engadget","recipient_name":"ThePlanet.com Internet Services, Inc.","works":[{"description":"Unknown work","infringing_urls":[],"copyrighted_urls":[]}],"tags":[],"jurisdictions":[],"action_taken":"Yes","language":null}}