{"dmca":{"id":24928,"type":"Dmca","title":"DMCA (Copyright) Complaint to Google","body":null,"date_sent":"2011-07-06T04:00:00Z","date_received":"2011-07-06T04:00:00Z","topics":["Copyright","DMCA Safe Harbor"],"sender_name":"Web Sheriff","principal_name":"POWDERED SUGAR PRODUCTIONS","recipient_name":"Google, Inc.","works":[{"description":"WEB SHERIFF\r\nUltimate Protection\r\nTel +44(0)208-3238013\r\nFax +44(0)208-3238080\r\nwebsheriff@websheriff.com\r\nwww.websheriff.com\r\n\r\nDMCA / EUCD NOTIFICATION\r\n\r\nNOTE : AN ORIGINAL HARD-COPY SIGNATURE FOR WEB SHERIFF IS LODGED ON FILE WITH GOOGLE. \r\n \r\n1. Rights Owner(s) : POWDERED SUGAR PRODUCTIONS\r\n \r\n2. Rights Agent :   WEB SHERIFF\r\n \r\n3. Infringed Rights :  COPYRIGHT, TRADEMARK, PERFORMERS & MORAL RIGHTS\r\n \r\n4. Infringed Artist(s) :  DARREN HAYES\r\n \r\n5. Infringed Title(s): VARIOUS (PIRATE)\r\n \r\n6. Infringing Activity : INFRINGEMENT OF COPYRIGHT / TRADEMARK / PERFORMERS RIGHTS / MORAL RIGHTS (VIA, INTER ALIA, PIRATED FILE UPLOADING / DOWNLOADING)\r\n\r\n7. Infringing Search Tag(s) :  \r\n\r\ndarren hayes talk talk talk\r\n\r\n8. Infringing Search Listing URL(s) :\r\n\r\nhttp://www.google.co.uk/search?sclient=psy&hl=en&safe=off&client=firefox-a&hs=uzS&rls=org.mozilla:en-GB%3Aofficial&source=hp&q=darren+hayes+talk+talk+talk&aq=f&aqi=&aql=&oq=&pbx=1&biw=1360&bih=591&cad=cbv\r\n \r\n9. Infringing Site Location(s) : \r\n \r\nhttp://www.filestube.com/d/darren+hayes+talk+talk+talk\r\nhttp://isohunt.com/torrents/Darren+Hayes+Talk+Talk+Talk+MP3+Secret+Codes+Battleships\r\nhttp://www.downloads.nl/music/Darren+Hayes+Talk+Talk+Talk\r\nhttp://www.jamxclusive.net/2011/06/27/darren-hayes-talk-talk-talk-itunes-plus-aac-m4a/\r\nhttp://www.youclubvideo.com/video/183502/darren-hayes-talk-talk-talk-2011\r\nhttp://blackout-popmusic.com/?p=6971\r\nhttp://torrentz.eu/da/darren+hayes+talk+talk+talk-q\r\nhttp://gosong.net/_Darren_Hayes_%E2%80%98Talk_Talk_Talk%E2%80%99.html\r\n \r\n \r\n9. DMCA Request : Please cease Infringing Activity / remove Infringed Title(s) from Infringing File Location(s) ASAP : thank you.\r\n \r\n11. Signature :\r\n \r\n\u201cI have a good faith belief that use of the copyrighted materials I will submit via email and allege to be infringing are not authorized by the copyright owner, its agent, or the law.\u201d\r\n \r\n\u201cI swear, under penalty of perjury, that the information I submit in each and every notification I will send to Google will be accurate and that I will be at the time of notification the copyright owner or authorized to act on behalf of the owner of an exclusive right that is allegedly infringed.\u201d\r\n \r\nDeborah Sykes\r\nfor and on behalf of\r\nWEB SHERIFF\r\n'Argentum'\r\n2 Queen Caroline Street\r\nLondon W6 9DX\r\nUnited Kingdom\r\nTel 44-(0)208-323 8013\r\nFax 44-(0)208-323 8080\r\nwebsheriff@websheriff.com\r\n(Signed as Duly Authorized Rights Agent\r\nof the Rights Owner(s) Specified Herein)\r\n \r\nNote 1 : The information in the notification is accurate and, under penalty of perjury, Web Sheriff is authorized to act on behalf of the exclusive owner of the rights alleged to have been infringed in this Notification. Both Web Sheriff and the Rights Owner specified herein have a good faith belief that the infringing party specified above has no right or entitlement to exploit the Infringed Rights specified herein.\r\n \r\nNote 2 : This DMCA request is issued without prejudice to all of our client's accumulated, worldwide rights in relation to the infringements specified herein - including, but not limited to, the right to seek injunctive relief, the right to sue for damages and the right to seek criminal prosecutions all of which rights are hereby reserved in full.  \r\n \r\n \r\n \r\n \r\nWeb Sheriff Ltd Co. No. 4093131  Reg'd in England & Wales\r\nLondon Office Argentum 2 Queen Caroline Street London W6 9DX\r\nReg'd Office Aurum 25 High Street Pewsey Wilts SN9 5AF\r\n \r\nDisclaimer :\r\nThis e-mail is the copyright of Web Sheriff. The contents of this e-mail are strictly private confidential, are for the attention of the addressee(s) only and may also qualify for legal privilege. This communication may not be disclosed or otherwise communicated to anyone other than the addressee(s), nor may it be copied or reproduced in any way without the written authorization of Web Sheriff. If received in error, please contact our London office on 00-44-(0)208-323 8013, quoting the name of the sender and the addressee(s), then please delete it from your system. Please note that whilst we have taken all reasonable steps to ensure there are no viruses contained within this e-mail and any attachments, it is your responsibility to ensure they are scanned and virus free. Neither Web Sheriff nor the sender accepts responsibility for any interception of this e-mail by unauthorized persons and please be aware that internet e-mail is not a completely secure method of communication.","infringing_urls":[{"url":"http://blackout-popmusic.com/?p=6971"},{"url":"http://gosong.net/_Darren_Hayes_%E2%80%98Talk_Talk_Talk%E2%80%99.html"},{"url":"http://isohunt.com/torrents/Darren+Hayes+Talk+Talk+Talk+MP3+Secret+Codes+Battleships"},{"url":"http://torrentz.eu/da/darren+hayes+talk+talk+talk-q"},{"url":"http://www.downloads.nl/music/Darren+Hayes+Talk+Talk+Talk"},{"url":"http://www.filestube.com/d/darren+hayes+talk+talk+talk"},{"url":"http://www.jamxclusive.net/2011/06/27/darren-hayes-talk-talk-talk-itunes-plus-aac-m4a/"},{"url":"http://www.youclubvideo.com/video/183502/darren-hayes-talk-talk-talk-2011"}],"copyrighted_urls":[{"url":"http://www.youtube.com/user/darrenhayes"}]}],"tags":[],"jurisdictions":[],"action_taken":"Yes","language":null}}