{"dmca":{"id":31093,"type":"Dmca","title":"Copyright infringement and phishing cheat report","body":" To Whom It May Concern:\r\n\r\nPlease note that below-referenced copyright infringement notice does not\r\nsubstantially comply with the required notification elements of the Digital\r\nMillennium Copyright Act of 1998 (\"DMCA\").\r\n\r\nPlease note that we have not passed on the substantive merits of your claim.\r\n\r\nPlease visit our web site at www.theplanet.com/legal.\r\n \r\nLegal Response Team\r\nTHEPLANET.COM INTERNET SERVICES, INC.\r\n\r\n-----Original Message-----\r\nFrom: Kevin Fenn [mailto:Kevin@softisland.com] \r\nSent: Thursday, December 29, 2005 2:43 PM\r\nTo: copyright@theplanet.com\r\nSubject: Copyright infringement and phishing cheat report\r\n\r\nHi theplanet.com\r\n\r\nWe received the reports from our buyers that someone copy our website [word\r\nby word] , the site url is http://www.igtu.com [IP:70.84.181.146] and\r\nhosting with theplanet.com , while our site is http://www.igxe.com . this\r\nsite has been hosting with theplanet.com from July 9, 2005.  they are using\r\npaypal account 4vsoft inc. [ cqxuhongju@hotmail.com ] to accpet payment\r\nonline.\r\n\r\nOur buyers complains that this site is exactly the same as our site and the\r\nbuyers pay through paypal, but got no service from this site.\r\n\r\nwe take it as Copyright infringement and phishing cheat as they copy our\r\nwhole site and collect money from our buyers but provide no service.\r\n\r\nwe have registered our trademark with USPTO [United States Patent and\r\nTrademark Office], for your information , we are providing our registration\r\ncode and information details, please hide them from the the site owner of\r\nigtu.com. \r\nhttp://tarr.uspto.gov/servlet/tarr?regser=serial&entry=78510319\r\n\r\n\r\nFor your reference, we provide one of claim reporting from our buyers:\r\n[Mike87]:?They do look alot like your page.\r\n[You]:?yes, i see\r\n[You]:?i will report it to our manager [Mike87]:?You have not heared about\r\nthem before? Maybe I shall call my bank and try to annulate it.\r\ncoz I didn't get any service from them after payment , I keep trying to\r\ncontact with them but got no response.\r\n[Mike87]:?I payed through Paypal tho, I think they have a \"scam\" protection\r\nor alike?\r\nIf I get that money back im sure to buy from this site. Just worried they\r\ngone for ever atm.\r\n[You]:?This site doesn't belong to us, they copied our site word by word. we\r\nwill report it to paypal.com [Mike87]:?Scam network?  \r\n\r\nWe take the copyright infringement issue seriously , we have contacted with\r\nthe site owner but got no response, we need your help. we require taking\r\nthis server offline in 48 hours. \r\n\r\nBest Regards\r\n\r\nKevin Fenn\r\nKevin@softisland.com\r\nLes Entreprises Softisland Inc.\r\nCanada","date_sent":"2005-12-29T05:00:00Z","date_received":"2005-12-29T05:00:00Z","topics":["Copyright","DMCA Safe Harbor"],"sender_name":null,"principal_name":"Les Entreprises Softisland Inc.","recipient_name":"ThePlanet.com Internet Services, Inc.","works":[{"description":"Unknown work","infringing_urls":[],"copyrighted_urls":[]}],"tags":[],"jurisdictions":[],"action_taken":"Yes","language":null}}