{"dmca":{"id":31652,"type":"Dmca","title":"Copyright infrigement","body":"\r\nTo Whom It May Concern:\r\n\r\n \r\n\r\nPlease note that below-referenced copyright infringement notice does not\r\nsubstantially comply with the required notification elements of the Digital\r\nMillennium Copyright Act of 1998 (\"DMCA\").\r\n\r\n \r\n\r\nPlease note that we have not passed on the substantive merits of your claim.\r\n\r\n \r\n\r\nPlease visit our web site at  <http://www.theplanet.com/legal>\r\nwww.theplanet.com/legal.\r\n\r\n \r\n\r\nLegal Response Team\r\n\r\nTHEPLANET.COM INTERNET SERVICES, INC.\r\n\r\n \r\n\r\n\r\n  _____  \r\n\r\nFrom: admin@e-topbiz.com [mailto:admin@e-topbiz.com] \r\nSent: Wednesday, December 21, 2005 4:59 AM\r\nTo: copyright@theplanet.com\r\nSubject: Copyright infrigement\r\n\r\n\r\nHi!\r\n \r\nI am the owner of site E-topbiz.com and my name is Goran. I live in Croatia.\r\n \r\nI sold few scripts with resell rights to owner of site Kiwi247.com which is\r\nhosted on one of your servers (Server IP 70.86.129.149 , nameservers\r\nNS1.MYPCHOST.COM and NS2.MYPCHOST.COM) , but my terms says that scripts that\r\nare purchased with resell rights can not be sold for less than I sell them.\r\nAnd this is exactly what this person doing on his site.\r\n \r\nI contacted him yesterday and kindly explained the problem, but he refused\r\nto obbey this rules. I also told him that I will be forced to report him to\r\nhosting data center, but he told me \"I know my host very well so that would\r\nbe a lost cause\". His complete email is available for review if needed.\r\n \r\nI kindly ask you to resolve this any way you find suitable (suspend his\r\naccount or entire server if needed).\r\n \r\nINFO:\r\n \r\n- domain: kiwi247.com\r\n- server IP: 70.86.129.149\r\n- nameservers he use: NS1.MYPCHOST.COM and NS2.MYPCHOST.COM\r\n\r\nScripts that he purchased from me and that he sells for lower prices on his\r\nsite:\r\n-  <http://www.kiwi247.com/products.php?cid=1>\r\nhttp://www.kiwi247.com/products.php?cid=1\r\n-  <http://www.kiwi247.com/products.php?cid=2>\r\nhttp://www.kiwi247.com/products.php?cid=2\r\n-  <http://www.kiwi247.com/products.php?cid=3>\r\nhttp://www.kiwi247.com/products.php?cid=3\r\n-  <http://www.kiwi247.com/products.php?cid=4>\r\nhttp://www.kiwi247.com/products.php?cid=4\r\n \r\nWhere on my site is stated that all scripts purchased with resell rights can\r\nnot be sold for less then I sell them:\r\n-  <http://e-topbiz.com/> http://e-topbiz.com/ , under \"Scripts With Resell\r\nRights - Scripts With Master Resell Rights\"\r\n-  <http://e-topbiz.com/terms.htm> http://e-topbiz.com/terms.htm\r\n- all pages with scripts description, which makes almost 50 pages\r\n \r\nScripts that kiwi247.com sells for lower prices on my site, listed in same\r\norder as above listing with links on his site:\r\n- http://e-topbiz.com/oprema/pages/ptr3.htm\r\n- http://e-topbiz.com/oprema/pages/autosurfscript7.htm\r\n- http://e-topbiz.com/oprema/pages/safelist3.htm\r\n- http://e-topbiz.com/oprema/pages/viral1.htm\r\n \r\nHope to see this resolved soon!\r\n \r\nThanks for your time.\r\n \r\nRegards\r\nGoran Kusnjer\r\nE-topbiz.com owner\r\n","date_sent":"2005-12-21T05:00:00Z","date_received":"2005-12-21T05:00:00Z","topics":["Copyright","DMCA Safe Harbor"],"sender_name":null,"principal_name":"E-topbiz.com","recipient_name":"ThePlanet.com Internet Services, Inc.","works":[{"description":"Unknown work","infringing_urls":[],"copyrighted_urls":[]}],"tags":[],"jurisdictions":[],"action_taken":"Yes","language":null}}