{"dmca":{"id":32198,"type":"Dmca","title":"[EV1-C2442965P] Copyright infringement - IMMEDIATE RESPOSE REQUIRED","body":" To Whom It May Concern:\r\n\r\nPlease note that below-referenced copyright infringement notice does not\r\nsubstantially comply with the required notification elements of the Digital\r\nMillennium Copyright Act of 1998 (\"DMCA\").\r\n\r\nPlease note that we have not passed on the substantive merits of your claim.\r\n\r\nPlease visit our web site at www.theplanet.com/index.html?p=copyright.\r\n \r\nLegal Response Team\r\nTHEPLANET.COM INTERNET SERVICES, INC.\r\n\r\n-----Original Message-----\r\nFrom: abuse@theplanet.com [mailto:abuse@theplanet.com] \r\nSent: Friday, January 05, 2007 11:44 AM\r\nTo: Copyright\r\nSubject: [EV1-C2442965P] Copyright infringement - IMMEDIATE RESPOSE REQUIRED\r\n\r\n==== Forwarded Ticket ====\r\n1. Copyright infringement - IMMEDIATE RESPOSE REQUIRED Added by system at Friday,\r\nJan 5 2007 05:40 pm\r\nX-MailFrom: info@evgeniaeremina.com\r\nX-RcptTo: abacus@abacus.ev1servers.net\r\nReceived: from [172.16.220.10] by [216.12.192.78] (abacus) for\r\n<abacus@abacus.ev1servers.net>; Fri Jan 5 17:40:02 2007\r\nReceived: from Exchanger.ev1servers.net ([207.218.222.102]) by\r\nDALD2EXCH01.PLANET.LOCAL with Microsoft SMTPSVC(6.0.3790.1830);\r\n  Fri, 5 Jan 2007 17:37:20 -0600\r\nReceived: from mailin.ev1servers.net ([207.218.222.124]) by Exchanger.ev1servers.net\r\nwith Microsoft SMTPSVC(6.0.3790.1830);\r\n  Fri, 5 Jan 2007 17:37:03 -0600\r\nX-ASG-Debug-ID: 1168040219-11608-130-0\r\nX-Barracuda-URL: http://207.218.222.124:8000/cgi-bin/mark.cgi\r\nX-ASG-Recipient-Whitelist:  abuse@ev1servers.net\r\nReceived: from mta11.adelphia.net (mta11.adelphia.net [68.168.78.205])  by\r\nmailin.ev1servers.net (Spam Firewall) with ESMTP id 1333244FB3 \r\n        for <abuse@ev1servers.net>; Fri,  5 Jan 2007 17:36:59 -0600 (CST)\r\nReceived: from [76.172.143.209] by mta11.adelphia.net \r\n          (InterMail vM.6.01.05.02 201-2131-123-102-20050715) with ESMTP \r\n          id <20070105233657.TUQN5532.mta11.adelphia.net@[76.172.143.209]> \r\n          for <abuse@ev1servers.net>; Fri, 5 Jan 2007 18:36:57 -0500\r\nUser-Agent: Microsoft-Entourage/11.3.2.061213\r\nDate: Fri, 05 Jan 2007 15:36:52 -0800\r\nX-ASG-Orig-Subj: Copyright infringement - IMMEDIATE RESPOSE REQUIRED\r\nSubject: Copyright infringement - IMMEDIATE RESPOSE REQUIRED\r\nFrom: Evgenia Eremina Official Website <info@evgeniaeremina.com>\r\nTo: <abuse@ev1servers.net>\r\nMessage-ID: <C1C42114.114B1%info@evgeniaeremina.com>\r\nThread-Topic: Copyright infringement - IMMEDIATE RESPOSE REQUIRED\r\nThread-Index: AccxImBwnyo5wp0VEduAWgAKlbYNlg==\r\nMime-version: 1.0\r\nContent-type: multipart/related; \r\n        boundary=\"B_3250856218_523196\" \r\nX-Virus-Scanned: by Barracuda Spam Firewall at ev1servers.net\r\nX-Barracuda-Spam-Score: 0.00\r\nX-Barracuda-Spam-Status: No, SCORE=0.00 using global scores of TAG_LEVEL=4.0\r\nQUARANTINE_LEVEL=1000.0 KILL_LEVEL=8.0 WHITELISTED\r\nReturn-Path: info@evgeniaeremina.com\r\nX-OriginalArrivalTime: 05 Jan 2007 23:37:03.0366 (UTC) FILETIME=[67371260:01C73122] \r\n\r\n (multipart/related)\r\nMultipart prefix (text/plain) \r\n> This message is in MIME format. Since your mail reader does not \r\n> understand\r\nthis format, some or all of this message may not be legible. \r\n \r\n (multipart/alternative)\r\nMIME element (text/plain) \r\n> Dear Mr. Huhtiniemi,\r\n>  \r\n> Evgenia Eremina (Ashanti) and I have tolerated all the plagiarism that \r\n> has gone on, on your site.  Entire articles and photos have been \r\n> lifted from our site, such as the one posted by Gemini37 on (your \r\n> site) http://peachyforum.com/forums/1/134798/ShowThread.aspx\r\n>  \r\n> This stolen from our site at http://www.evgeniaermina.com/html/bio.htm\r\n>  \r\n> Phenix has posted copyrighted photos from Met-Art.com on \r\n> http://peachyforum.com/forums/6/134798/ShowThread.aspx  as well as \r\n> links to sites that plagiarize her photos.\r\n>  \r\n> Even this link http://hosted.teensgoporn.com/hard/017/?ref=511252  \r\n> from your page http://peachyforum.com/forums/1/350427/ShowThread.aspx \r\n> was published without her consent and you will find no Title 18 \r\n> Section 2257 compliance notice that she was 18 years old at the time \r\n> the photos were shot, because none exist.  In fact we are going into \r\n> litigation again Paul Lisinski, owner of TeensGoPorn.com over these same photos\r\nand other linked to your site.\r\n>  \r\n> Yet when I posted something yesterday, asking her fans to support her \r\n> by going to eBay and buying her signed photos, you banned my for a \r\n> century and a half, till December 13, 2156, 6:39 AM and there was \r\n> added some ridiculous comment about my somehow selling her photos without her\r\nknowledge.\r\n>  \r\n> Then there is the statement that: \r\n>  \r\n> Her real name iz [sic] Evgenia Eremina, also known as Ashanti. Russian \r\n> whore that lives in St. Petersbug [sic]. I contacted her, for $250 \r\n> she'll do everything for you but she doesn't travel.\r\n> http://peachyforum.com/forums/2/134798/ShowThread.aspx\r\n>  \r\n> You need to remove all the plagiarized and defamatory content; that \r\n> means every photo we or the photographers or the websites who own them \r\n> do not give you permission to use.\r\n>  \r\n> Your record keeping compliance statement maintains: \r\n>  \r\n> All visual depictions displayed on this website (domain), whether of \r\n> actual sexually explicit conduct, simulated sexual content or \r\n> otherwise, are visual depictions of persons who were at least 18 years \r\n> of age when those visual depictions were created. All other visual \r\n> depictions displayed on this website are exempt from 18 U.S.C. \r\n> 2257(a)-(c) because said visual depictions are not visual depictions \r\n> of conduct specifically listed in 18 U.S.C Section 2256 (2) (A)-(D), \r\n> but are merely depictions of non-sexually explicit nudity, or are \r\n> depictions of simulated sexual conduct, or are otherwise exempt \r\n> because the visual depictions were created prior to July 3, 1995, or \r\n> were produced, manufactured, published, duplicated, reproduced, or \r\n> reissued before July 3, 1995. The owners and operators of this website \r\n> are secondary producers and not primary producer, as defined in 18 U.S.C. Section\r\n2257 Sec. 75.1 (C)(1)-(2), non-US citizens and located outside US.\r\n>  \r\n> That your site is non-sexual is about as far from the truth as you can get. \r\n> Your site represents hardcore pornography in its strictest definition, \r\n> down to your logo of an anthropomorphized peach with its tongue \r\n> hanging out and the quote from the movie Face Off of \u00b3I could eat a \r\n> peach for hours...\u00b2\r\n>  \r\n> The US Department of Justice can seek to imprison fine both you and \r\n> those ThePlanet.com\r\n>  \r\n> The law states;\r\n>  \r\n> Whoever violates this section shall be imprisoned for not more than 5 \r\n> years, and fined in accordance with the provisions of this title, or \r\n> both. Whoever violates this section after having been convicted of a \r\n> violation punishable under this section shall be imprisoned for any \r\n> period of years not more than 10 years but not less than 2 years, and \r\n> fined in accordance with the provisions of this title, or both.\r\n>  \r\n> Using the photos is a copyright infringement, as prohibited by the U.S. \r\n> Copyright Act, 17 U.S.C. 101 et seq., (see\r\n> http://lcweb.loc.gov/copyright/title17/) and International copyright \r\n> law and is in direct violation of the international rights of the copyright owner.\r\n> If the content is not taken down we will seek damages to the statutory \r\n> maximum of $150,000 per image. 17 U.S.C. \u00a7 504(c)(2) and you have a \r\n> lot of images, especially considering those you facilitate through your links.\r\n>  \r\n> Additionally, I am certain this is a common practice on all of your \r\n> forums and on your main site, which generates money for you through \r\n> thousands of affiliate links.\r\n>  \r\n>  \r\n \r\n \r\nEvgenia Eremina\r\nImages of Perfection \r\n                    \r\n \r\n \r\nhttp://www.evgeniaeremina.com\r\nhttp://www.zhenia.com ","date_sent":"2007-01-05T05:00:00Z","date_received":"2007-01-05T05:00:00Z","topics":["Copyright","DMCA Safe Harbor"],"sender_name":null,"principal_name":"Evgenia Eremina","recipient_name":"ThePlanet.com Internet Services","works":[{"description":"Unknown work","infringing_urls":[],"copyrighted_urls":[]}],"tags":[],"jurisdictions":[],"action_taken":"Yes","language":null}}