{"dmca":{"id":34562,"type":"Dmca","title":"[EV1-C1320912S] Breach of World Guides Copyright","body":" \r\nTo Whom It May Concern:\r\n\r\nPlease note that below-referenced copyright infringement notice does not\r\nsubstantially comply with the required notification elements of the\r\nDigital Millennium Copyright Act of 1998 (\"DMCA\").\r\n\r\nPlease note that we have not passed on the substantive merits of your\r\nclaim.\r\n\r\nPlease visit our web site at www.theplanet.com/legal.\r\n \r\nLegal Response Team\r\nTHEPLANET.COM INTERNET SERVICES, INC.\r\n-----Original Message-----\r\nFrom: abuse@ev1.net [mailto:abuse@ev1.net] \r\nPosted At: Thursday, October 12, 2006 12:02 AM\r\nPosted To: Copyright\r\nConversation: [EV1-C1320912S] Breach of World Guides Copyright\r\nSubject: [EV1-C1320912S] Breach of World Guides Copyright\r\n\r\n\r\n==== Forwarded Ticket ====\r\n1. Breach of World Guides Copyright\r\nAdded by system at Thursday, Oct 12 2006 03:26 am\r\nX-MailFrom: info@world-guides.com\r\nX-RcptTo: abacus@abacus.ev1servers.net\r\nReceived: from [70.87.6.111] by [216.12.192.78] (abacus) for\r\n<abacus@abacus.ev1servers.net>; Thu Oct 12 04:23:45 2006\r\nReceived: from mail.theplanet.com ([216.185.111.52]) by\r\nsmtp02.theplanet.com with Microsoft SMTPSVC(6.0.3790.1830);\r\n  Thu, 12 Oct 2006 04:21:36 -0500\r\nReturn-path: <info@world-guides.com>\r\nDelivery-date: Thu, 12 Oct 2006 04:21:36 -0500\r\nReceived: from mx02.inside.filter.theplanet.com ([172.16.214.181]\r\nhelo=mx02.filter.theplanet.com)  by mail.theplanet.com (envelope-from\r\ninfo@world-guides.com)  with esmtps (TLSv1:DHE-RSA-AES256-SHA:256)\r\n (Exim)\r\n id 1GXwky-0001ew-8v\r\n for abuse@theplanet.com; Thu, 12 Oct 2006 04:21:36 -0500\r\nReceived: from moutng.kundenserver.de ([212.227.126.183]) \r\n        by mx02.filter.theplanet.com (envelope-from\r\ninfo@world-guides.com) \r\n        with esmtp (Exim) \r\n        id 1GXwkv-0003VG-BK \r\n        for abuse@theplanet.com; Thu, 12 Oct 2006 04:21:33 -0500\r\nReceived: from [86.27.88.36] (helo=[192.168.0.3]) \r\n        by mrelayeu.kundenserver.de (node=mrelayeu2) with ESMTP\r\n(Nemesis), \r\n        id 0MKwtQ-1GXwks0Q82-0003Pz; Thu, 12 Oct 2006 11:21:30 +0200\r\nMime-Version: 1.0 (Apple Message framework v752.2)\r\nContent-Type: text/plain; charset=US-ASCII; delsp=yes; format=flowed\r\nMessage-Id: <659B699E-7600-4FCA-8247-74FEF7D7969F@world-guides.com>\r\nCc: abuse@theplanet.com\r\nContent-Transfer-Encoding: 7bit\r\nFrom: World Guides <info@world-guides.com>\r\nSubject: Breach of World Guides Copyright\r\nDate: Thu, 12 Oct 2006 10:21:32 +0100\r\nTo: gibs0n@skysquad.net\r\nX-Mailer: Apple Mail (2.752.2)\r\nX-Provags-ID: kundenserver.de abuse@kundenserver.de\r\nlogin:fa083ced01784c217b428b1b3203cfeb\r\nReceived-SPF: none (mx02.filter.theplanet.com: 212.227.126.183 is\r\nneither permitted nor denied by domain of world-guides.com)\r\nclient-ip=212.227.126.183; envelope-from=info@world-guides.com;\r\nhelo=moutng.kundenserver.de;\r\nX-OriginalArrivalTime: 12 Oct 2006 09:21:36.0449 (UTC)\r\nFILETIME=[D0E05310:01C6EDDF] \r\n\r\nMIME element (text/plain)\r\nDear Webmaster, \r\n \r\nPlease could you arrange for our listing to be removed from your page \r\n \r\nhttp://74.gtzyyim.info/ \r\n \r\nThe listing reads as folllows: \r\n \r\nWorld Guides: Venice \r\nVisitors will find that there is a vast selection of Venice hotels to   \r\nsuit every taste and budget. Venice accommodation ranges from the   \r\nmost luxurious ... \r\nhttp://www.venice.world-guides.com/ \r\n \r\nThank you for you help and please advise us when this has been done   \r\nso we can close our Breach of Copyright query. \r\n \r\nRegards, \r\n \r\nMartin \r\n \r\nWORLD GUIDES","date_sent":"2006-10-12T04:00:00Z","date_received":"2006-10-12T04:00:00Z","topics":["Copyright","DMCA Safe Harbor"],"sender_name":null,"principal_name":"World Guides","recipient_name":"ThePlanet.com Internet Services, Inc.","works":[{"description":"Unknown work","infringing_urls":[],"copyrighted_urls":[]}],"tags":[],"jurisdictions":[],"action_taken":"Yes","language":null}}