{"dmca":{"id":34960,"type":"Dmca","title":"[ThePlanetAbuse-C3185343D] DMCA Complaint (The Digital Millenium Copyright Act)","body":"-----Original Message-----\r\nFrom: abuse@theplanet.com [mailto:abuse@theplanet.com] \r\nSent: Thursday, February 22, 2007 5:10 AM\r\nTo: Copyright\r\nSubject: [ThePlanetAbuse-C3185343D] DMCA Complaint (The Digital\r\nMillenium Copyright Act)\r\n\r\n==== Forwarded Ticket ====\r\n1. DMCA Complaint (The Digital Millenium Copyright Act)\r\nAdded by system at Thursday, Feb 22 2007 10:58 am \r\nX-MailFrom: legal@ovalcom.com \r\nX-RcptTo: abacus@abacus.ev1servers.net \r\nReceived: from [216.12.192.67] by [216.12.192.78] (abacus) for\r\n<abacus@abacus.ev1servers.net>; Thu Feb 22 10:57:16 2007 \r\nReceived: (qmail 5002 invoked by alias); 22 Feb 2007 16:57:16 -0000 \r\nDelivered-To: abuse@inbound.abacus.ev1servers.net \r\nReceived: (qmail 4999 invoked from network); 22 Feb 2007 16:57:16 -0000 \r\nReceived: from smtp02.theplanet.com (70.87.6.111) \r\n  by inbound.abacus.ev1servers.net with SMTP; 22 Feb 2007 16:57:16 -0000\r\n\r\nReceived: from mail.theplanet.com ([216.185.111.52]) by\r\nsmtp02.theplanet.com with Microsoft SMTPSVC(6.0.3790.1830); \r\n  Thu, 22 Feb 2007 10:57:15 -0600 \r\nReturn-path: <legal@ovalcom.com> \r\nDelivery-date: Thu, 22 Feb 2007 10:57:15 -0600 \r\nReceived: from mx02.inside.filter.theplanet.com ([172.16.214.181]\r\nhelo=mx02.filter.theplanet.com) \r\n by mail.theplanet.com (envelope-from legal@ovalcom.com) \r\n with esmtps (TLSv1:DHE-RSA-AES256-SHA:256) \r\n (Exim) \r\n id 1HKHFr-0005R4-Jk \r\n        for abuse@theplanet.com; Thu, 22 Feb 2007 10:57:15 -0600 \r\nReceived: from carbon.hostingmadeeasy.com ([74.52.188.104]) \r\n        by mx02.filter.theplanet.com (envelope-from legal@ovalcom.com) \r\n        with esmtps (TLSv1:DHE-RSA-AES256-SHA:256) \r\n        (Exim) \r\n        id 1HKHFd-0009nt-AH \r\n        for abuse@theplanet.com; Thu, 22 Feb 2007 10:57:01 -0600 \r\nReceived: from cpanel by carbon.hostingmadeeasy.com with local (Exim\r\n4.63) \r\n        (envelope-from <legal@ovalcom.com>) \r\n        id 1HKHFU-00023e-PH; Thu, 22 Feb 2007 10:56:52 -0600 \r\nReceived: from 124.29.212.79 ([124.29.212.79]) by www.ovalcom.com (Horde\r\n\r\n        MIME library) with HTTP; Thu, 22 Feb 2007 10:56:52 -0600 \r\nMessage-ID: <20070222105652.8l3kzxo0w480c0w0@www.ovalcom.com> \r\nDate: Thu, 22 Feb 2007 10:56:52 -0600 \r\nFrom: Ovalcom Inc <legal@ovalcom.com> \r\nTo: abuse@theplanet.com \r\nCc: contact@ovalcom.com \r\nSubject: DMCA Complaint (The Digital Millenium Copyright Act) \r\nMIME-Version: 1.0 \r\nContent-Type: text/plain; \r\n        charset=ISO-8859-1; \r\n        DelSp=\"Yes\"; \r\n        format=\"flowed\" \r\nContent-Disposition: inline \r\nContent-Transfer-Encoding: quoted-printable \r\nUser-Agent: Internet Messaging Program (IMP) H3 (4.1.3) \r\nX-AntiAbuse: This header was added to track abuse, please include it\r\nwith any abuse report \r\nX-AntiAbuse: Primary Hostname - carbon.hostingmadeeasy.com \r\nX-AntiAbuse: Original Domain - theplanet.com \r\nX-AntiAbuse: Originator/Caller UID/GID - [32002 32002] / [47 12] \r\nX-AntiAbuse: Sender Address Domain - ovalcom.com \r\nX-Source: /usr/local/cpanel/3rdparty/bin/php \r\nX-Source-Args: /usr/local/cpanel/3rdparty/bin/php\r\n/usr/local/cpanel/base/horde/imp/compose.php  \r\nX-Source-Dir: :/base/horde/imp \r\nX-OriginalArrivalTime: 22 Feb 2007 16:57:15.0991 (UTC)\r\nFILETIME=[81741E70:01C756A2] \r\n\r\nMIME element (text/plain) \r\nFebruary, 22nd, 2007 \r\n \r\nOvalcom Inc \r\nNabeel Khalid, Owner \r\nlegal@ovalcom.com \r\n+923004918365 \r\n381-2-C1, Township \r\nLahore, Pakistan, 54770 \r\n \r\nDemand to ISP Under the Digital Millenium Copyright Act \r\n \r\nThePlanet, Inc \r\nC/O Copyright Agent for Notice of Claims of Copyright Infringement \r\nhttp://www.insidethesports.com/ hosted on IP: 67.18.160.106 \r\n \r\nDear ThePlanet, Inc. \r\n \r\nI, Nabeel Khalid owner of Ovalcom Inc, certify under penalty of   \r\nperjury, that I am an agent authorized to act on behalf of the owner   \r\nof certain intellectual property rights. \r\n \r\nI have a good faith belief that the items or materials listed below   \r\nare not authorized by law for use by the above named domain name owner\r\n\r\nor their agents and therefore infringes the copyright owner's rights.   \r\nI have attempted to resolve this directly with the account holder   \r\nwithout satisfaction. I hereby demand that you act expeditiously to   \r\nremove or disable access to the material or items claimed to be   \r\ninfringing and take other appropriate action against the account   \r\nholder to prevent future infringement. \r\nOur Copyright Statement can be found at:\r\nhttp://www.ovalcom.com/copyright.htm \r\n \r\nMy contact information is as follows: \r\n \r\nOvalcom Inc \r\nNabeel Khalid, CEO \r\ncontact@pawas.com \r\n+923004918365 \r\n381-2-C1, Township \r\nLahore, Pakistan, 54770 \r\n \r\n \r\nAllegedly Infringing items or materials: \r\nThe Site owner has duplicated more than 400 pages from our Network\r\nWebsites. \r\n \r\nInfringing material that I demand be disabled or removed in   \r\nconsideration of the above: \r\n \r\nThese duplicate pages came to our attention on February, 21st, 2007 \r\n \r\n1. Duplicate Page: http://www.insidethesports.com/1/tennis-shoes.html \r\n(Including all pages linked on that page) \r\n \r\n2. Duplicate Page: http://www.insidethesports.com/2/bridal-shoes.html \r\n(Including all pages linked on that page) \r\n \r\n3. Duplicate Page: http://www.insidethesports.com/2/dress-shoes.html \r\n(Including all pages linked on that page) \r\n \r\n4. Duplicate Page:\r\nhttp://www.insidethesports.com/1/basketball-shoes.html \r\n(Including all pages linked on that page) \r\n \r\n5. Duplicate Page:\r\nhttp://www.insidethesports.com/3/jessica-simpson-shoes.html \r\n(Including all pages linked on that page) \r\n \r\n6. Duplicate Page: http://www.insidethesports.com/3/vans-shoes.html \r\n(Including all pages linked on that page) \r\n \r\n7. Duplicate Page: http://www.insidethesports.com/2/womens-shoes.html \r\n(Including all pages linked on that page) \r\n \r\n8. Duplicate Page: http://www.insidethesports.com/2/girls-shoes.html \r\n(Including all pages linked on that page) \r\n \r\n9. Duplicate Page: http://www.insidethesports.com/2/ballet-shoes.html \r\n(Including all pages linked on that page) \r\n \r\n10. Duplicate Page: http://www.insidethesports.com/2/dsw-shoes.html \r\n(Including all pages linked on that page) \r\n \r\n11. Duplicate Page: http://www.insidethesports.com/2/sas-shoes.html \r\n(Including all pages linked on that page) \r\n \r\n12. Duplicate Page: http://www.insidethesports.com/2/merrell-shoes.html \r\n(Including all pages linked on that page) \r\n \r\n13. Duplicate Page:\r\nhttp://www.insidethesports.com/2/nine-west-shoes.html \r\n(Including all pages linked on that page) \r\n \r\n14. Duplicate Page: http://www.insidethesports.com/2/born-shoes.html \r\n(Including all pages linked on that page) \r\n \r\n15. Duplicate Page:\r\nhttp://www.insidethesports.com/2/naturalizer-shoes.html \r\n(Including all pages linked on that page) \r\n \r\n16. Duplicate Page: http://www.insidethesports.com/2/diesel-shoes.html \r\n(Including all pages linked on that page) \r\n \r\n17. Duplicate Page: http://www.insidethesports.com/2/payless-shoes.html \r\n(Including all pages linked on that page) \r\n \r\n18. Duplicate Page:\r\nhttp://www.insidethesports.com/2/steve-madden-shoes.html \r\n(Including all pages linked on that page) \r\n \r\n19. Duplicate Page: http://www.insidethesports.com/2/lacoste-shoes.html \r\n(Including all pages linked on that page) \r\n \r\n20. Duplicate Page: http://www.insidethesports.com/2/adidas-shoes.html \r\n(Including all pages linked on that page) \r\n \r\n21. Duplicate Page: http://www.insidethesports.com/2/puma-shoes.html \r\n(Including all pages linked on that page) \r\n \r\n22. Duplicate Page: http://www.insidethesports.com/2/bass-shoes.html \r\n(Including all pages linked on that page) \r\n \r\n23. Duplicate Page: http://www.insidethesports.com/2/rockport-shoes.html\r\n\r\n(Including all pages linked on that page) \r\n \r\n24. Duplicate Page:\r\nhttp://www.insidethesports.com/2/taryn-rose-shoes.html \r\n(Including all pages linked on that page) \r\n \r\n \r\nLocation of ORIGINAL WORKS: \r\nOur network websites, which falls under Ovalcom Copyright statement. \r\n \r\n1. Original Work: http://www.tennis-shoes.us/ \r\n(Including all pages linked on that page) \r\n \r\n2. Original Work: http://www.bridal-shoes.us/ \r\n(Including all pages linked on that page) \r\n \r\n3. Original Work: http://www.dress-shoes.biz/ \r\n(Including all pages linked on that page) \r\n \r\n4. Original Work: http://www.basketball-shoes.us/ \r\n(Including all pages linked on that page) \r\n \r\n5. Original Work: http://www.jessicasimpsonshoes.org/ \r\n(Including all pages linked on that page) \r\n \r\n6. Original Work: http://www.vans-shoes.us/ \r\n(Including all pages linked on that page) \r\n \r\n7. Original Work: http://www.womens-shoes9.com/ \r\n(Including all pages linked on that page) \r\n \r\n8. Original Work: http://www.girls-shoes.net/ \r\n(Including all pages linked on that page) \r\n \r\n9. Original Work: http://www.ballet-shoes.org \r\n(Including all pages linked on that page) \r\n \r\n10. Original Work: http://www.dswreview.com/ \r\n(Including all pages linked on that page) \r\n \r\n11. Original Work: http://www.sas-shoes.us/ \r\n(Including all pages linked on that page) \r\n \r\n12. Original Work: http://www.merrell-shoes.org/ \r\n(Including all pages linked on that page) \r\n \r\n13. Original Work: http://www.nine-west-shoes.net/ \r\n(Including all pages linked on that page) \r\n \r\n14. Original Work: http://www.born-shoes.org/ \r\n(Including all pages linked on that page) \r\n \r\n15. Original Work: http://www.naturalizer-shoes.org/ \r\n(Including all pages linked on that page) \r\n \r\n16. Original Work: http://www.diesel-shoes.org/ \r\n(Including all pages linked on that page) \r\n \r\n17. Original Work: http://www.payless-shoes.org/ \r\n(Including all pages linked on that page) \r\n \r\n18. Original Work: http://www.steve-madden-shoes.net/ \r\n(Including all pages linked on that page) \r\n \r\n19. Original Work: http://www.lacoste-shoes.net/ \r\n(Including all pages linked on that page) \r\n \r\n20. Original Work: http://www.adidas-shoes.org/ \r\n(Including all pages linked on that page) \r\n \r\n21. Original Work: http://www.puma-shoes.us/ \r\n(Including all pages linked on that page) \r\n \r\n22. Original Work: http://www.bass-shoes.org/ \r\n(Including all pages linked on that page) \r\n \r\n23. Original Work: http://www.rockport-shoes.net/ \r\n(Including all pages linked on that page) \r\n \r\n24. Original Work: http://www.tarynroseshoes.us/ \r\n(Including all pages linked on that page) \r\n \r\n \r\nPlease contact me promptly to confirm the action you have taken. \r\n \r\nMy electronic signature follows: \r\nNabeel Khalid \r\n ","date_sent":"2007-02-25T05:00:00Z","date_received":"2007-02-25T05:00:00Z","topics":["Copyright","DMCA Safe Harbor"],"sender_name":null,"principal_name":"Ovalcom Inc","recipient_name":"Theplanet.com","works":[{"description":"Unknown work","infringing_urls":[],"copyrighted_urls":[]}],"tags":[],"jurisdictions":[],"action_taken":"Yes","language":null}}