{"dmca":{"id":37602,"type":"Dmca","title":"[Fwd: [ABUSE] DMCA Notice (Ref: R3235)]","body":"-----Original Message-----\r\nFrom: The Planet Policy Enforcement [mailto:abuse@theplanet.com] \r\nSent: Monday, September 27, 2004 10:16 AM\r\nTo: Legal Response\r\nSubject: [Fwd: [ABUSE] DMCA Notice (Ref: R3235)]\r\n\r\nForwarding to Legal for review.\r\n\r\n-------- Original Message --------\r\nReceived:         from spooling.theplanet.com ([69.56.141.4]\r\nhelo=lili.theplanet.com) by mail.theplanet.com with smtp (Exim 4.42) id\r\n1CBwWX-0005ij-Ji for abuseadm@theplanet.com; Mon, 27 Sep 2004 09:30:41 -0500\r\nReceived:         (qmail 10560 invoked from network); 27 Sep 2004 14:30:41\r\n-0000\r\nReceived:         from unknown (HELO ?216.185.111.52?) (172.16.214.110) by\r\nlili.theplanet.com with SMTP; 27 Sep 2004 14:30:41 -0000\r\nReceived:         from [195.40.39.2] (helo=1401A.ifpi.org) by\r\nmail.theplanet.com with esmtp (Exim 4.42) id 1CBwWH-0005S8-Nj; Mon, 27\r\nSep 2004 09:30:26 -0500\r\nReceived:         from 0401a.ifpi.org (Not Verified[172.16.100.3]) by\r\n1401A.ifpi.org with NetIQ MailMarshal (v5.5.6.7) id <B00008df88>; Mon,\r\n27 Sep 2004 15:29:17 +0100\r\ncontent-class:         urn:content-classes:message\r\nMIME-Version:         1.0\r\nDate:         Mon, 27 Sep 2004 15:29:16 +0100\r\nContent-Type:         multipart/signed;\r\nboundary=\"----=_NextPart_000_013E_01C4A4A6.C0162660\";\r\nprotocol=\"application/x-pkcs7-signature\"; micalg=SHA1\r\nX-MimeOLE:         Produced By Microsoft Exchange V6.0.6375.0\r\nMessage-ID:         <861AA26933B0EC4EABE60BE88FC858632D6EDA@0401a.ifpi.org>\r\nX-MS-Has-Attach:         yes\r\nX-MS-TNEF-Correlator:         \r\nThread-Topic:         DMCA Notice (Ref: R3235)\r\nThread-Index:         AcSknl5II4K9eBNsTV2CvhcZ/Ssjhw==\r\nX-Priority:         1\r\nPriority:         Urgent\r\nImportance:         high\r\nFrom:         Notices <Notices@ifpi.org>\r\nTo:         <abuse@theplanet.com>, <copyright@theplanet.com>\r\nReceived-SPF:         none (mail.theplanet.com: 195.40.39.2 is neither\r\npermitted nor denied by domain of ifpi.org) client-ip=195.40.39.2;\r\nenvelope-from=Notices@ifpi.org; helo=1401A.ifpi.org;\r\nCc:         \r\nSubject:         [ABUSE] DMCA Notice (Ref: R3235)\r\nX-BeenThere:         abuse@lists.theplanet.com\r\nX-Mailman-Version:         2.1.5\r\nPrecedence:         list\r\nList-Id:         abuse.lists.theplanet.com\r\nList-Unsubscribe:         <http://lists.theplanet.com/mailman/listinfo/abuse>,\r\n<mailto:abuse-request@lists.theplanet.com?subject=unsubscribe>\r\nList-Archive:         <http://lists.theplanet.com/mailman/private/abuse>\r\nList-Post:         <mailto:abuse@lists.theplanet.com>\r\nList-Help:         <mailto:abuse-request@lists.theplanet.com?subject=help>\r\nList-Subscribe:         <http://lists.theplanet.com/mailman/listinfo/abuse>,\r\n<mailto:abuse-request@lists.theplanet.com?subject=subscribe>\r\nSender:         abuse-bounces@lists.theplanet.com\r\nErrors-To:         abuse-bounces@lists.theplanet.com\r\n\r\n\r\n\r\n27 September 2004\r\n\r\n\r\n\r\nLance Crosby\r\n\r\nTheplanet.com Internet Services\r\n\r\n1333 North Stemmons Freeway\r\n\r\nSuite 110\r\n\r\n75207\r\n\r\nDallas\r\n\r\nUnited States\r\n\r\nTelephone: +1 854-7679\r\n\r\nE-mail: abuse@theplanet.com\r\n\r\nE-mail: copyright@theplanet.com\r\n\r\n/ /\r\n\r\nRef: R3235\r\n\r\nRe:\r\n\r\nhttp://giant.servercities.com/~cseweb/albums/\r\n\r\n\r\n\r\nDear Sir/Madam,\r\n\r\n\r\n\r\nI am contacting you on behalf of the International Federation of the\r\nPhonographic Industry (IFPI) and its member record companies.  The IFPI\r\nis a trade association whose member companies are some 1,500 major and\r\nindependent record companies in the US and internationally who create,\r\nmanufacture and distribute sound recordings. Under penalty of perjury,\r\nwe submit that the IFPI is authorized to act on behalf of its member\r\ncompanies in matters involving the infringement of their sound\r\nrecordings, including enforcing their copyrights and common law rights\r\non the Internet.\r\n\r\n\r\n\r\nWe have learned that your service is hosting infringing files on its\r\nnetwork (see above referenced directory).  These files contain sound\r\nrecordings by the artists known as Jimmy Eat World.  These sound\r\nrecordings are owned by one of our member companies and have not been\r\nauthorized for this kind of use.  We have a good faith belief that the\r\nabove-described activity is not authorized by the copyright owner, its\r\nagent, or the law.  We assert that the information in this notification\r\nis accurate, based upon the data available to us.\r\n\r\n\r\n\r\nWe are asking for your immediate assistance in stopping this\r\nunauthorized activity.  Specifically, we request that you remove the\r\ninfringing files from* *your system or that you disable access to the\r\ninfringing files.  In addition, please inform the site operator of the\r\nillegality of his or her conduct.\r\n\r\n\r\n\r\nYou should understand that this letter constitutes notice to you that\r\nthis site operator may be liable for the infringing activity occurring\r\non your service. In addition, under the Digital Millennium Copyright\r\nAct, if you ignore this notice, you and/or your company may also be\r\nliable for any resulting infringement. This letter does not constitute a\r\nwaiver of any right to recover damages incurred by virtue of any such\r\nunauthorized activities, and such rights as well as claims for other\r\nrelief are expressly retained.\r\n\r\n\r\n\r\nYou may contact me at IFPI Secretariat, 54 Regent Street, London W1B\r\n5RE, United Kingdom or email Notices@ifpi.org, to discuss this notice.\r\nWe await your response.\r\n\r\n\r\n\r\nSincerely,\r\n\r\n\r\n\r\n\r\n\r\n\r\n\r\n\r\n\r\n\r\n   */Mr /*/Paul Mitchell///\r\n\r\nInternet Anti-Piracy Administrator\r\n\r\nIFPI Secretariat\r\n\r\n54 Regent Street\r\n\r\n\r\n   *London* W1B 5RE\r\n\r\nUnited Kingdom\r\n\r\n\r\n\r\nTel: +44 (0)20 7878 7915\r\n\r\n\r\n     Fax: +44 (0)20 7878 6832\r\n\r\nE-mail: _Notices__@ifpi.org_\r\n\r\nWebsite: www.ifpi.org <http://www.ifpi.org/>\r\n\r\n\r\n\r\n\r\n\r\n\r\n\r\n\r\n\r\n\r\n-- \r\nThanks,\r\nGarrett White\r\nPolicy Enforcement\r\nThe Planet Internet Services, Inc.\r\nhttp://www.theplanet.com/aup/\r\n\r\n","date_sent":"2004-09-27T04:00:00Z","date_received":"2004-09-27T04:00:00Z","topics":["Copyright","DMCA Safe Harbor"],"sender_name":null,"principal_name":"IFPI","recipient_name":"Theplanet.com","works":[{"description":"Unknown work","infringing_urls":[],"copyrighted_urls":[]}],"tags":[],"jurisdictions":[],"action_taken":"Yes","language":null}}